id	gen	kind	description	val_mse	strength	verdict	commit
1	1	train	batch 256, lr 4e-3	0.10339	-	KEEP	3b39ea4
2	1	train	batch 512, lr 6e-3	0.10150	-	KEEP	8c76d2f
3	1	train	batch 1024, lr 8e-3	0.09885	-	KEEP	320f0aa
4	1	train	batch 2048, lr 1e-2	0.09705	-	KEEP	1fdb4cb
5	1	train	batch 4096, lr 1.5e-2	0.09727	-	REVERT	29bbc64
6	1	train	hidden [128,64]	0.10028	-	REVERT	a4fea04
7	1	train	cosine lr over the budget (was x0.7 per epoch)	0.09657	-	REVERT	a798c58
8	1	train	net.ts: allocation-free forward/backward (throughput)	0.09715	-	REVERT	fd844f9
9	1	train	fast loop + hidden [128,64] + cosine lr	0.09761	-	REVERT	895c9ed
10	1	features	features: remaining-bag composition (8 dims)	0.09667	-	REVERT	197a2ac
11	1	train	L2 1e-4 (was 1e-5)	0.09689	-	REVERT	da0837b
12	1	train	standardise inputs (folded into layer 0 at export)	0.10621	-	REVERT	4cd8ad2
13	1	train	fast loop + hidden [96,48]	0.09841	-	REVERT	a37281e
14	1	train	hidden [32,16] (smaller)	0.09758	-	REVERT	9e4357f
4s	1	strength	exp 4 candidate vs reference (promoted to shipped weights)	0.09705	STRENGTH win=0.490 ref_win=0.308 margin=2.05 ref_margin=-2.09 z=3.78 games=400	KEEP	9ef24da
16	1b	train	fast loop + best-checkpoint export (gen1b)	0.10024	-	REVERT	7678e8a
17	1b	features	encoder v2: opening geometry, fillability, contest gaps, merge potential, unclaimed features (142 dims)	0.10757	-	REVERT	20211fa
18	1b	train	residual target: r = z - H, deploy H + 1.0 r (gen1b)	0.10052	-	REVERT	76db75f
17s	1b	strength	encoder v2 candidate vs gen-0 reference	0.10757	STRENGTH win=0.485 ref_win=0.313 margin=2.46 ref_margin=-2.51 z=3.57 games=400	INFO	-
b75	1b	strength	blend net-weight 0.75 (shipped weights) vs gen-0 reference	-	STRENGTH win=0.490 ref_win=0.308 margin=2.69 ref_margin=-2.75 z=3.78 games=400	INFO	-
21	1b	train	pairwise difference loss from the Actions benchmark (1200 roots), weight 1.0, every 4th batch	0.10041	-	REVERT	d4d170f
22	1b	train	pairwise difference loss from the Actions benchmark (1200 roots), weight 1.0, every 4th batch [regret metric]	0.10041 regret=1.152	-	REVERT	408d1a1
23	1b	train	pairwise loss every batch (weight 1.0) [regret metric]	0.10128 regret=1.194	-	REVERT	f38e5be
17h	1b	strength	encoder v2 candidate vs shipped v1 (head-to-head)	-	STRENGTH win=0.423 ref_win=0.374 margin=0.41 ref_margin=-0.45 z=1.00 games=400	INFO	-
b75h	1b	strength	blend net-weight 0.75 vs shipped 0.5 (head-to-head)	-	STRENGTH win=0.278 ref_win=0.523 margin=-4.88 ref_margin=4.88 z=-5.17 games=400	REVERT	-
b25h	1b	strength	blend net-weight 0.25 vs shipped 0.5 (head-to-head)	-	STRENGTH win=0.627 ref_win=0.171 margin=9.70 ref_margin=-9.80 z=10.53 games=400	KEEP-PENDING-SWEEP	-
24	1b	features	encoder v2 + pairwise loss — INVALID: pairs were 86-dim so none loaded; identical to exp 17 (net 1.258, blend 1.156, Δ -0.063±0.078)	0.10757 regret=1.156	-	INVALID	-
28	1b	features	encoder v2 + pairwise loss (every 4th batch, pairs re-encoded) [regret metric]	0.10675 regret=1.144	-	REVERT	7efecbd
29	1b	train	pairwise loss every 4th batch, 2400 training roots, 800 held-out [regret metric]	0.10838 regret=1.003	-	REVERT	7a5eb1a
b00h	1b	strength	blend 0.0 (pure heuristic) vs shipped 0.5	-	STRENGTH win=0.464 ref_win=0.338 margin=4.03 ref_margin=-3.88 z=2.59 games=400	INFO	-
b10h	1b	strength	blend 0.1 vs shipped 0.5	-	STRENGTH win=0.495 ref_win=0.306 margin=4.58 ref_margin=-4.54 z=3.93 games=400	INFO	-
b25p	1b	strength	PROMOTE blend net-weight 0.25 (sweep peak: 0.0 +4.0, 0.1 +4.6, 0.25 +9.7, 0.5 ref, 0.75 -4.9)	-	see b25h	KEEP	e067bdf
b15h	1b	strength	blend 0.15 vs shipped 0.25	-	STRENGTH win=0.387 ref_win=0.414 margin=-0.20 ref_margin=0.23 z=-0.55 games=400	INFO	-
b35h	1b	strength	blend 0.35 vs shipped 0.25	-	STRENGTH win=0.378 ref_win=0.421 margin=-0.29 ref_margin=0.28 z=-0.88 games=400	INFO	-
v2@25	1b	strength	encoder v2 candidate vs shipped (blend 0.25)	-	STRENGTH win=0.433 ref_win=0.369 margin=0.55 ref_margin=-0.52 z=1.31 games=400	INFO	-
29p	1b	strength	PROMOTE exp 29 pairwise-trained net vs shipped (blend 0.25)	-	STRENGTH win=0.443 ref_win=0.356 margin=0.68 ref_margin=-0.70 z=1.78 games=400	KEEP	036925f
37	1b	features	encoder v2 + pairwise (2400 roots re-encoded), own split [regret metric]	0.10651 regret=0.982	-	REVERT	f9d9b24
r5	1b	strength	reserveValue 5 vs shipped 7	-	STRENGTH win=0.378 ref_win=0.419 margin=-1.07 ref_margin=0.96 z=-0.84 games=400	REVERT	-
r9	1b	strength	reserveValue 9 vs shipped 7	-	STRENGTH win=0.402 ref_win=0.399 margin=-0.28 ref_margin=0.27 z=0.06 games=400	REVERT	-
v2p	2	strength	encoder v2 + pairwise (18k games) vs shipped	0.10675	STRENGTH win=0.406 ref_win=0.395 margin=0.55 ref_margin=-0.50 z=0.22 games=400	REVERT	-
g2	2	strength	gen2 round: v1 encoder + pairwise on 18k games vs shipped	0.10121	STRENGTH win=0.411 ref_win=0.367 margin=0.52 ref_margin=-0.52 z=0.87 games=360	REVERT	-
hsw8	1b	strength	hard staticWeight 0.8 vs 0.6 (hard-vs-hard)	-	STRENGTH win=0.385 ref_win=0.436 margin=-0.11 ref_margin=0.10 z=-0.95 games=340	REVERT	-
hsw4	1b	strength	hard staticWeight 0.4 vs 0.6 (hard-vs-hard)	-	STRENGTH win=0.395 ref_win=0.427 margin=0.46 ref_margin=-0.42 z=-0.60 games=340	REVERT	-
opp10	1b	strength	oppBestWeight 1.0 vs shipped 0.7	-	STRENGTH win=0.394 ref_win=0.405 margin=0.18 ref_margin=-0.17 z=-0.22 games=400	REVERT	-
opp04	1b	strength	PROMOTE oppBestWeight 0.4 vs shipped 0.7	-	STRENGTH win=0.434 ref_win=0.369 margin=1.23 ref_margin=-1.11 z=1.33 games=400	KEEP	8fd0b23
opp00	1b	strength	oppBestWeight 0.0 vs shipped 0.4	-	STRENGTH win=0.370 ref_win=0.434 margin=-0.09 ref_margin=0.10 z=-1.31 games=400	REVERT	-
opp02	1b	strength	oppBestWeight 0.2 vs shipped 0.4	-	STRENGTH win=0.403 ref_win=0.397 margin=0.14 ref_margin=-0.14 z=0.12 games=400	REVERT	-
hr24	1b	strength	hard rollouts 24 vs 12 (hard-vs-hard)	-	STRENGTH win=0.423 ref_win=0.402 margin=0.72 ref_margin=-0.66 z=0.40 games=340	REVERT	-
hc8	2	search	hard shortlist 8 vs 5 (hard-vs-hard)	-	STRENGTH win=0.423 ref_win=0.402 margin=0.72 ref_margin=-0.66 z=0.40 games=340	REVERT	-
sl10	2	strength	chanceSlope 0.10 vs shipped 0.16	-	STRENGTH win=0.358 ref_win=0.441 margin=-0.52 ref_margin=0.51 z=-1.70 games=400	REVERT	-
sl24	2	strength	chanceSlope 0.24 vs shipped 0.16	-	STRENGTH win=0.363 ref_win=0.433 margin=-0.40 ref_margin=0.37 z=-1.44 games=400	REVERT	-
hand	2	strength	pure heuristic (net weight 0) vs shipped bot, direct	-	STRENGTH win=0.295 ref_win=0.505 margin=-3.18 ref_margin=3.18 z=-4.39 games=400	INFO	-
mac-v2	2	strength	[Mac, 2p only, 640 seats] v2 encoder net (exp17) vs shipped	-	STRENGTH win=0.561 ref_win=0.436 margin=1.46 ref_margin=-1.52 z=3.19 games=640	CONFIRMING	-
mac-b30	2	strength	[Mac, 2p only, 640 seats] blend 0.30 vs shipped 0.25	-	STRENGTH win=0.558 ref_win=0.439 margin=1.15 ref_margin=-1.22 z=3.03 games=640	CONFIRMING	-
mac-b20	2	strength	[Mac, 2p only, 640 seats] blend 0.20 vs shipped 0.25	-	STRENGTH win=0.524 ref_win=0.474 margin=0.33 ref_margin=-0.34 z=1.27 games=640	CONFIRMING	-
mac-d07	2	strength	[Mac, 2p only, 640 seats] reserveDecay 0.7 vs shipped 0.6	-	STRENGTH win=0.528 ref_win=0.469 margin=0.83 ref_margin=-0.92 z=1.51 games=640	CONFIRMING	-
mac-d05	2	strength	[Mac, 2p only, 640 seats] reserveDecay 0.5 vs shipped 0.6	-	STRENGTH win=0.514 ref_win=0.486 margin=-0.04 ref_margin=0.04 z=0.71 games=640	REVERT	-
mac-f06	2	strength	[Mac, 2p only, 640 seats] farmOpenFactor 0.6 vs shipped 0.8	-	STRENGTH win=0.532 ref_win=0.469 margin=0.48 ref_margin=-0.47 z=1.58 games=640	CONFIRMING	-
mac-o03	2	strength	[Mac, 2p only, 640 seats] oppBestWeight 0.3 vs shipped 0.4	-	STRENGTH win=0.520 ref_win=0.480 margin=0.86 ref_margin=-0.85 z=1.03 games=640	CONFIRMING	-
mac-o05	2	strength	[Mac, 2p only, 640 seats] oppBestWeight 0.5 vs shipped 0.4	-	STRENGTH win=0.494 ref_win=0.506 margin=-0.04 ref_margin=0.04 z=-0.32 games=640	REVERT	-
mac-r6	2	strength	[Mac, 2p only, 640 seats] reserveValue 6 vs shipped 7	-	STRENGTH win=0.476 ref_win=0.523 margin=-1.15 ref_margin=1.10 z=-1.19 games=640	REVERT	-
mac-r8	2	strength	[Mac, 2p only, 640 seats] reserveValue 8 vs shipped 7	-	STRENGTH win=0.502 ref_win=0.498 margin=0.08 ref_margin=-0.07 z=0.08 games=640	REVERT	-
mac-g2	2	strength	[Mac, 2p only, 640 seats] gen2 pairwise net (v1 encoder) vs shipped	-	STRENGTH win=0.494 ref_win=0.507 margin=-0.11 ref_margin=0.12 z=-0.32 games=640	REVERT	-
cf-v2	2	strength	[confirm, 2p+3p, seed 8101] v2 encoder net (exp17) vs shipped	-	STRENGTH win=0.407 ref_win=0.393 margin=0.24 ref_margin=-0.22 z=0.40 games=800	FLAT	-
cf-b30	2	strength	[confirm, 2p+3p, seed 8102] blend 0.30 vs shipped 0.25	-	STRENGTH win=0.413 ref_win=0.387 margin=0.19 ref_margin=-0.20 z=0.74 games=800	FLAT	-
cf-v2b30	2	strength	[confirm, 2p+3p, seed 8103] v2 encoder net + blend 0.30 vs shipped	-	STRENGTH win=0.486 ref_win=0.314 margin=1.89 ref_margin=-1.88 z=5.04 games=800	CONFIRMING	-
c1-v2	2	strength	[Actions confirm1, 2p+3p, 1600 seats] v2 encoder net (exp17) vs shipped v1 exp29	-	STRENGTH win=0.449 ref_win=0.352 margin=1.09 ref_margin=-1.07 z=3.98 games=1600	PROMOTE	-
c1-v2b30	2	strength	[Actions confirm1, 1600 seats] v2 encoder + blend 0.30 vs shipped	-	STRENGTH win=0.430 ref_win=0.369 margin=1.03 ref_margin=-1.04 z=2.50 games=1600	KEEP (not better than v2 alone)	-
c1-b30	2	strength	[Actions confirm1, 1600 seats] blend 0.30 vs shipped 0.25	-	STRENGTH win=0.405 ref_win=0.395 margin=0.19 ref_margin=-0.20 z=0.39 games=1600	REVERT	-
c1-b20	2	strength	[Actions confirm1, 1600 seats] blend 0.20 vs shipped 0.25	-	STRENGTH win=0.374 ref_win=0.425 margin=-0.61 ref_margin=0.58 z=-2.06 games=1600	REVERT	-
c1-d07	2	strength	[Actions confirm1, 1600 seats] reserveDecay 0.7 vs 0.6	-	STRENGTH win=0.400 ref_win=0.400 margin=0.18 ref_margin=-0.18 z=0.00 games=1600	REVERT	-
c1-f06	2	strength	[Actions confirm1, 1600 seats] farmOpenFactor 0.6 vs 0.8	-	STRENGTH win=0.466 ref_win=0.331 margin=1.41 ref_margin=-1.47 z=5.54 games=1600	KEEP (re-test on v2)	-
c1-f10	2	strength	[Actions confirm1, 1600 seats] farmOpenFactor 1.0 vs 0.8	-	STRENGTH win=0.358 ref_win=0.443 margin=-1.31 ref_margin=1.36 z=-3.48 games=1600	REVERT	-
c1-o03	2	strength	[Actions confirm1, 1600 seats] oppBestWeight 0.3 vs 0.4	-	STRENGTH win=0.389 ref_win=0.411 margin=-0.05 ref_margin=0.05 z=-0.92 games=1600	REVERT	-
c1-hd6	2	strength	[Actions confirm1, 1600 seats] hard depth 6 vs 4 (hard-vs-hard)	-	STRENGTH win=0.417 ref_win=0.383 margin=0.39 ref_margin=-0.40 z=1.36 games=1600	KEEP? (re-test)	-
c1-ht300	2	strength	[Actions confirm1, 1600 seats] hard thinkMs 300 vs 150 (hard-vs-hard)	-	STRENGTH win=0.384 ref_win=0.416 margin=-0.23 ref_margin=0.23 z=-1.30 games=1600	REVERT	-
r2-old	3	strength	[Actions round2, 1600 seats] old shipped (v1 exp29) vs new shipped (v2 exp17)	-	STRENGTH win=0.370 ref_win=0.430 margin=-0.68 ref_margin=0.68 z=-2.42 games=1600	INFO (promotion confirmed)	-
r2-f06	3	strength	[Actions round2, 1600 seats] farmOpenFactor 0.6 vs 0.8	-	STRENGTH win=0.438 ref_win=0.360 margin=0.93 ref_margin=-0.98 z=3.21 games=1600	KEEP	-
r2-f05	3	strength	[Actions round2, 1600 seats] farmOpenFactor 0.5 vs 0.8	-	STRENGTH win=0.436 ref_win=0.365 margin=1.01 ref_margin=-0.98 z=2.91 games=1600	KEEP	-
r2-f04	3	strength	[Actions round2, 1600 seats] farmOpenFactor 0.4 vs 0.8	-	STRENGTH win=0.455 ref_win=0.347 margin=1.44 ref_margin=-1.39 z=4.44 games=1600	PROMOTE	-
r2-v2pw	3	strength	[Actions round2, 1600 seats] v2 pairwise net (18k) vs shipped exp17	-	STRENGTH win=0.386 ref_win=0.414 margin=-0.61 ref_margin=0.62 z=-1.14 games=1600	REVERT	-
r2-b35	3	strength	[Actions round2, 1600 seats] blend 0.35 vs 0.25 (v2 net)	-	STRENGTH win=0.439 ref_win=0.360 margin=1.00 ref_margin=-1.03 z=3.22 games=1600	KEEP (confirm on farm 0.4)	-
r2-b20	3	strength	[Actions round2, 1600 seats] blend 0.20 vs 0.25 (v2 net)	-	STRENGTH win=0.339 ref_win=0.462 margin=-1.16 ref_margin=1.18 z=-5.04 games=1600	REVERT	-
r2-hd6	3	strength	[Actions round2, 1600 seats] hard depth 6 vs 4	-	STRENGTH win=0.415 ref_win=0.386 margin=0.31 ref_margin=-0.30 z=1.19 games=1600	KEEP? (2nd positive)	-
r2-hd3	3	strength	[Actions round2, 1600 seats] hard depth 3 vs 4	-	STRENGTH win=0.404 ref_win=0.396 margin=0.30 ref_margin=-0.31 z=0.31 games=1600	REVERT	-
r2-r8	3	strength	[Actions round2, 1600 seats] reserveValue 8 vs 7	-	STRENGTH win=0.403 ref_win=0.396 margin=0.04 ref_margin=-0.05 z=0.29 games=1600	REVERT	-
r3-cg03	3	strength	[Actions round3, 1600 seats] cityGrowth 0.3 vs 0.6	-	STRENGTH win=0.389 ref_win=0.411 margin=-0.25 ref_margin=0.26 z=-0.91 games=1600	REVERT	-
r3-cg09	3	strength	[Actions round3, 1600 seats] cityGrowth 0.9 vs 0.6	-	STRENGTH win=0.396 ref_win=0.404 margin=-0.25 ref_margin=0.26 z=-0.32 games=1600	REVERT	-
r3-rg025	3	strength	[Actions round3, 1600 seats] roadGrowth 0.25 vs 0.5	-	STRENGTH win=0.391 ref_win=0.408 margin=-0.05 ref_margin=0.05 z=-0.68 games=1600	REVERT	-
r3-rg075	3	strength	[Actions round3, 1600 seats] roadGrowth 0.75 vs 0.5	-	STRENGTH win=0.385 ref_win=0.415 margin=-0.24 ref_margin=0.23 z=-1.24 games=1600	REVERT	-
r3-h12	3	strength	[Actions round3, 1600 seats] reserveHorizon 12 vs 18	-	STRENGTH win=0.420 ref_win=0.380 margin=0.43 ref_margin=-0.43 z=1.62 games=1600	MARGINAL	-
r3-h27	3	strength	[Actions round3, 1600 seats] reserveHorizon 27 vs 18	-	STRENGTH win=0.389 ref_win=0.411 margin=-0.57 ref_margin=0.58 z=-0.91 games=1600	REVERT	-
r3-tpe4	3	strength	[Actions round3, 1600 seats] chanceTilesPerEdge 4 vs 5	-	STRENGTH win=0.396 ref_win=0.404 margin=-0.40 ref_margin=0.38 z=-0.32 games=1600	REVERT	-
r3-tpe7	3	strength	[Actions round3, 1600 seats] chanceTilesPerEdge 7 vs 5	-	STRENGTH win=0.419 ref_win=0.380 margin=0.21 ref_margin=-0.22 z=1.57 games=1600	MARGINAL	-
r4-f02	3	strength	[Actions round4, 1600 seats] farmOpenFactor 0.2 vs 0.4	-	STRENGTH win=0.398 ref_win=0.402 margin=-0.06 ref_margin=0.06 z=-0.14 games=1600	REVERT	-
r4-f00	3	strength	[Actions round4, 1600 seats] farmOpenFactor 0.0 vs 0.4	-	STRENGTH win=0.380 ref_win=0.420 margin=-0.33 ref_margin=0.33 z=-1.62 games=1600	REVERT	-
r4-b35	3	strength	[Actions round4, 1600 seats] blend 0.35 vs 0.25 (on farm 0.4)	-	STRENGTH win=0.414 ref_win=0.387 margin=0.28 ref_margin=-0.27 z=1.09 games=1600	MARGINAL	-
r4-b45	3	strength	[Actions round4, 1600 seats] blend 0.45 vs 0.25 (on farm 0.4)	-	STRENGTH win=0.417 ref_win=0.384 margin=0.62 ref_margin=-0.59 z=1.34 games=1600	MARGINAL (re-test)	-
r4-hd6	3	strength	[Actions round4, 1600 seats] hard depth 6 vs 4 (3rd try)	-	STRENGTH win=0.397 ref_win=0.403 margin=0.16 ref_margin=-0.16 z=-0.24 games=1600	REVERT	-
r4-hd8	3	strength	[Actions round4, 1600 seats] hard depth 8 vs 4	-	STRENGTH win=0.365 ref_win=0.436 margin=-0.74 ref_margin=0.76 z=-2.88 games=1600	REVERT	-
r4-hs05	3	strength	[Actions round4, 1600 seats] hard staticWeight 0.5 vs 0.6	-	STRENGTH win=0.392 ref_win=0.408 margin=0.10 ref_margin=-0.10 z=-0.68 games=1600	REVERT	-
r4-o05	3	strength	[Actions round4, 1600 seats] oppBestWeight 0.5 vs 0.4 (on v2)	-	STRENGTH win=0.416 ref_win=0.384 margin=0.09 ref_margin=-0.09 z=1.34 games=1600	REVERT (no margin)	-
g3-b90	3	train	gen3: value loss, v2 encoder, 26k games (gen1+gen2+gen3), 90 s	0.09623	-	CANDIDATE (round 5)	-
g3-b300	3	train	gen3: same, 300 s (2.5 epochs)	0.09420	-	CANDIDATE (round 5)	-
g3-b900	3	train	gen3: same, 900 s (7 epochs)	0.09329	-	CANDIDATE (round 6)	-
g3-wide	3	train	gen3: [128,64], 900 s (3 epochs)	0.09394	-	REVERT (worse than [64,32] at equal time, 2x slower to run)	-
r5-g3b90	3	strength	[Actions round5, 1600 seats] gen3 net 90 s vs shipped exp17	-	STRENGTH win=0.383 ref_win=0.417 margin=-0.10 ref_margin=0.10 z=-1.42 games=1600	REVERT	-
r5-g3b300	3	strength	[Actions round5, 1600 seats] gen3 net 300 s vs shipped exp17	-	STRENGTH win=0.427 ref_win=0.373 margin=0.49 ref_margin=-0.50 z=2.21 games=1600	KEEP (re-test on blend 0.45)	-
r5-g3b35	3	strength	[Actions round5, 1600 seats] gen3 300 s + blend 0.35 vs shipped	-	STRENGTH win=0.430 ref_win=0.371 margin=0.68 ref_margin=-0.66 z=2.40 games=1600	KEEP	-
r5-g3b45	3	strength	[Actions round5, 1600 seats] gen3 300 s + blend 0.45 vs shipped	-	STRENGTH win=0.422 ref_win=0.378 margin=0.60 ref_margin=-0.59 z=1.79 games=1600	KEEP	-
r5-b45	3	strength	[Actions round5, 3200 seats pooled a+b] blend 0.45 vs 0.25 (exp17 net, farm 0.4)	-	STRENGTH win=0.432 ref_win=0.369 margin=0.89 ref_margin=-0.87 z=3.67 games=3200	PROMOTE	-
r6-g3b900	3	strength	[Actions round6, 3200 seats pooled a+b] gen3 net 900 s vs shipped exp17 (blend 0.45)	-	STRENGTH win=0.419 ref_win=0.381 margin=0.50 ref_margin=-0.50 z=2.14 games=3200	PROMOTE	-
r6-g3b300	3	strength	[Actions round6, 3200 seats pooled a+b] gen3 net 300 s vs shipped exp17 (blend 0.45)	-	STRENGTH win=0.423 ref_win=0.378 margin=0.40 ref_margin=-0.39 z=2.64 games=3200	KEEP (900 s promoted instead)	-
r6-b55	3	strength	[Actions round6, 1600 seats] blend 0.55 vs 0.45	-	STRENGTH win=0.410 ref_win=0.390 margin=0.59 ref_margin=-0.59 z=0.85 games=1600	REVERT	-
r6-b65	3	strength	[Actions round6, 1600 seats] blend 0.65 vs 0.45	-	STRENGTH win=0.411 ref_win=0.390 margin=0.26 ref_margin=-0.25 z=0.86 games=1600	REVERT	-
g4-b900	4	train	gen4: value loss, v2 encoder, 34k games (gen1–gen4), 900 s (5 epochs)	0.09158	-	CANDIDATE (round 8)	-
r7-old17	4	strength	[Actions round7, 1600 seats] old shipped exp17 vs new shipped gen3-b900	-	STRENGTH win=0.377 ref_win=0.423 margin=-0.69 ref_margin=0.68 z=-1.87 games=1600	INFO (promotion confirmed)	-
r7-h12	4	strength	[Actions round7, 1600 seats] reserveHorizon 12 vs 18 (2nd independent seed)	-	STRENGTH win=0.427 ref_win=0.373 margin=0.13 ref_margin=-0.13 z=2.19 games=1600	PROMOTE (with round 3)	-
r7-tpe7	4	strength	[Actions round7, 1600 seats] chanceTilesPerEdge 7 vs 5 (2nd seed)	-	STRENGTH win=0.408 ref_win=0.393 margin=0.16 ref_margin=-0.15 z=0.62 games=1600	REVERT	-
r7-hs07	4	strength	[Actions round7, 1600 seats] hard staticWeight 0.7 vs 0.6	-	STRENGTH win=0.386 ref_win=0.414 margin=-0.06 ref_margin=0.06 z=-1.16 games=1600	REVERT	-
r7-hr20	4	strength	[Actions round7, 1600 seats] hard rollouts 20 vs 12	-	STRENGTH win=0.385 ref_win=0.415 margin=-0.45 ref_margin=0.46 z=-1.22 games=1600	REVERT	-
r7-r6	4	strength	[Actions round7, 1600 seats] reserveValue 6 vs 7 (on gen3)	-	STRENGTH win=0.385 ref_win=0.415 margin=-0.24 ref_margin=0.24 z=-1.23 games=1600	REVERT	-
g4-b1800	4	train	gen4: same, 1800 s (10 epochs; lr has decayed to 3% by then)	0.09112	-	CANDIDATE (round 9)	-
r8-g4	4	strength	[Actions round8, 3200 seats pooled a+b] gen4 net 900 s vs shipped gen3-b900	-	STRENGTH win=0.400 ref_win=0.400 margin=0.11 ref_margin=-0.12 z=-0.01 games=3200	REVERT (flat)	-
r8-g4b55	4	strength	[Actions round8, 1600 seats] gen4 net 900 s + blend 0.55 vs shipped	-	STRENGTH win=0.425 ref_win=0.376 margin=0.75 ref_margin=-0.72 z=2.02 games=1600	KEEP? (re-test)	-
r9-g4b1800	4	strength	[Actions round9, 3200 seats pooled a+b] gen4 net 1800 s vs shipped gen3-b900	-	STRENGTH win=0.422 ref_win=0.377 margin=0.46 ref_margin=-0.47 z=2.58 games=3200	KEEP (b900@0.55 stronger)	-
r9-g4b55	4	strength	[Actions rounds 8+9, 3200 seats pooled] gen4 net 900 s + blend 0.55 vs shipped gen3 @0.45	-	STRENGTH win=0.437 ref_win=0.365 margin=0.84 ref_margin=-0.81 z=4.17 games=3200	PROMOTE	-
r9-g4b1800b55	4	strength	[Actions round9, 1600 seats] gen4 net 1800 s + blend 0.55 vs shipped	-	STRENGTH win=0.416 ref_win=0.384 margin=0.40 ref_margin=-0.40 z=1.32 games=1600	MARGINAL	-
r9-h9	4	strength	[Actions round9, 1600 seats] reserveHorizon 9 vs 12	-	STRENGTH win=0.401 ref_win=0.398 margin=-0.10 ref_margin=0.10 z=0.12 games=1600	REVERT	-
r10-old	4	strength	[Actions round10, 1600 seats] old shipped gen3 @0.45 vs new shipped gen4 @0.55	-	STRENGTH win=0.374 ref_win=0.427 margin=-0.43 ref_margin=0.44 z=-2.18 games=1600	INFO (promotion confirmed)	-
r10-b65	4	strength	[Actions round10, 1600 seats] blend 0.65 vs 0.55	-	STRENGTH win=0.415 ref_win=0.385 margin=0.22 ref_margin=-0.22 z=1.21 games=1600	MARGINAL	-
r10-b75	4	strength	[Actions round10, 1600 seats] blend 0.75 vs 0.55	-	STRENGTH win=0.404 ref_win=0.396 margin=-0.19 ref_margin=0.19 z=0.34 games=1600	REVERT	-
r10-hand	4	strength	[Actions round10, 1600 seats] bare heuristic (blend 0) vs shipped	-	STRENGTH win=0.288 ref_win=0.513 margin=-2.99 ref_margin=3.00 z=-9.41 games=1600	INFO	-
v3-b900	4	features	encoder v3: v2 + hand EV components per seat (160 dims), 34k games, 900 s (v2 same data/budget: 0.09158)	0.09191	-	CANDIDATE (round 11)	-
r11-v3	4	strength	[Actions round11, 3200 seats pooled a+b] encoder v3 net vs shipped gen4 v2 @0.55	-	STRENGTH win=0.378 ref_win=0.422 margin=-0.46 ref_margin=0.46 z=-2.54 games=3200	REVERT	-
r11-v3b65	4	strength	[Actions round11, 1600 seats] encoder v3 net + blend 0.65 vs shipped	-	STRENGTH win=0.404 ref_win=0.396 margin=0.15 ref_margin=-0.16 z=0.33 games=1600	REVERT	-
g5-b900	5	train	gen5: value loss, v2 encoder, 42k games (gen1–gen5), 900 s (4 epochs)	0.08961	-	CANDIDATE (round 12)	-
r12-g5	5	strength	[Actions round12, 3200 seats pooled a+b] gen5 net (42k games) vs shipped gen4 @0.55	-	STRENGTH win=0.382 ref_win=0.418 margin=-0.29 ref_margin=0.28 z=-2.09 games=3200	REVERT	-
r12-g5b65	5	strength	[Actions round12, 1600 seats] gen5 net + blend 0.65 vs shipped	-	STRENGTH win=0.379 ref_win=0.422 margin=-0.43 ref_margin=0.46 z=-1.74 games=1600	REVERT	-
